{
  "date": "2026-06-02",
  "title": "Market Beat — News Impact Analysis",
  "subtitle": "17 headlines analyzed · 3 levels of impact traced · 48 tickers scored",
  "region": "GLOBAL",
  "version": "0.2",
  "sources": [
    "Yahoo Finance",
    "CNBC",
    "Reuters",
    "Bloomberg"
  ],
  "mood": [
    {
      "label": "S&P 500 (fut)",
      "value": "7,620",
      "delta": "-0.04%",
      "tone": "neg"
    },
    {
      "label": "Nasdaq 100 (fut)",
      "value": "30,676",
      "delta": "-0.12%",
      "tone": "neg"
    },
    {
      "label": "Dow (fut)",
      "value": "51,374",
      "delta": "-0.05%",
      "tone": "neg"
    },
    {
      "label": "WTI Crude",
      "value": "$94.75",
      "delta": "+1.06%",
      "tone": "pos"
    },
    {
      "label": "Brent",
      "value": "$96.10",
      "delta": "+0.93%",
      "tone": "pos"
    },
    {
      "label": "Gold",
      "value": "$4,508",
      "delta": "-0.26%",
      "tone": "neg"
    },
    {
      "label": "Bitcoin",
      "value": "$66,477",
      "delta": "-6.16%",
      "tone": "neg"
    },
    {
      "label": "Nikkei 225",
      "value": "68,452",
      "delta": "+2.57%",
      "tone": "pos"
    },
    {
      "label": "10y Yield",
      "value": "4.21%",
      "delta": "flat",
      "tone": "neu"
    },
    {
      "label": "VIX",
      "value": "17.4",
      "delta": "-1.2%",
      "tone": "pos"
    }
  ],
  "news": [
    {
      "id": 1,
      "headline": "Marvell soars +32.5% — Jensen Huang calls it 'the next trillion-dollar company'",
      "source": "Yahoo Finance · 2h ago",
      "url": "https://finance.yahoo.com/markets/stocks/article/marvell-stock-soars-as-nvidia-ceo-calls-chipmaker-the-next-trillion-dollar-company-130932917.html",
      "category": "AI · Semis",
      "priority": 10,
      "confidence": "HIGH",
      "tickers": [
        {
          "symbol": "MRVL",
          "score": 3
        },
        {
          "symbol": "NVDA",
          "score": 2
        },
        {
          "symbol": "AVGO",
          "score": 2
        },
        {
          "symbol": "TSM",
          "score": 1
        },
        {
          "symbol": "MU",
          "score": 1
        },
        {
          "symbol": "LITE",
          "score": 1
        },
        {
          "symbol": "INTC",
          "score": -1
        },
        {
          "symbol": "KWEB",
          "score": -2,
          "note": "Chinese chip ETFs"
        }
      ],
      "levels": {
        "L1": {
          "text": "Nvidia CEO publicly endorses Marvell at Computex; MRVL +32.5%. Validates Marvell's custom AI accelerator (XPU) + optical-networking business serving MSFT & AMZN. Targets $10B+ custom-silicon revenue by FY29."
        },
        "L2": {
          "text": "Custom-silicon peers (AVGO) and optical-networking suppliers (LITE, COHR, INFN) re-rate. Foundry beneficiary TSM. Memory plays MU / Samsung / SK Hynix get sympathy bid. Data-center REITs EQIX, DLR get demand validation."
        },
        "L3": {
          "text": "Reinforces 'AI infra capex super-cycle'; supports Goldman's Taiwan/Korea overweight call. Pressure on INTC (left behind) and Chinese chip names (US restrictions widen gap). Pulls capital into Asia tech ETFs (EWT, EWY)."
        }
      },
      "beneficiaries": [
        "MRVL shareholders — massive re-rating, $254B → narrative toward $1T",
        "NVDA — strengthens partnership/ecosystem moat ($2B MRVL investment)",
        "AVGO — custom-silicon halo trade",
        "TSM & ASML — foundry/equipment pull-through",
        "Optical networking: LITE, COHR, INFN"
      ],
      "victims": [
        "INTC — increasingly absent from AI accelerator conversation",
        "Chinese semis (SMIC, KWEB exposure) — US tech gap widens",
        "Generic merchant-silicon vendors — custom XPUs eat their TAM"
      ],
      "timeline": {
        "D": "Momentum chase in MRVL, AVGO, LITE; pair-trade vs INTC.",
        "W": "Sell-side PTs raised; options skew in MRVL gets crushed.",
        "M": "FY29 custom-silicon guide becomes consensus baseline.",
        "L": "Solidifies hyperscaler-custom-silicon model; INTC strategic risk."
      },
      "sentiment": "mixed"
    },
    {
      "id": 2,
      "headline": "Palo Alto Networks beats & raises — AI-cyber demand surges",
      "source": "Reuters · 6h ago",
      "url": "https://finance.yahoo.com/markets/stocks/articles/palo-alto-raises-annual-forecasts-205221784.html",
      "category": "Cybersecurity · AI",
      "priority": 9,
      "confidence": "HIGH",
      "tickers": [
        {
          "symbol": "PANW",
          "score": 3
        },
        {
          "symbol": "ZS",
          "score": 2
        },
        {
          "symbol": "CRWD",
          "score": 2
        },
        {
          "symbol": "FTNT",
          "score": 2
        },
        {
          "symbol": "OKTA",
          "score": 1
        },
        {
          "symbol": "NTSK",
          "score": 1
        },
        {
          "symbol": "NVDA",
          "score": 1
        },
        {
          "symbol": "GEN",
          "score": -1,
          "note": "Legacy AV vendors"
        }
      ],
      "levels": {
        "L1": {
          "text": "Q3 rev $3.0B (+31% YoY), beat $2.94B. FY guide raised: revenue $11.42–11.43B, adj EPS $3.77–3.79. Stock +7.4% AH. Mgmt cites AI-driven threat surface accelerating platform consolidation."
        },
        "L2": {
          "text": "Validates the 'platformization' thesis — sympathy bids in ZS, CRWD, FTNT, OKTA. Pre-IPO/private names (NTSK, Wiz) get implied mark-ups. NVDA + MRVL benefit (security needs more inference compute)."
        },
        "L3": {
          "text": "Enterprise IT budgets prioritize security over discretionary SaaS — pressures CRM/WDAY share-of-wallet. Re-raises M&A risk premium for niche security tools. Confirms cyber as a 'rate-insensitive' growth pocket."
        }
      },
      "beneficiaries": [
        "PANW — raised guide validates platform strategy",
        "ZS, CRWD, FTNT — sympathy trade and pricing power",
        "NTSK / Wiz / Island — private-market mark-ups",
        "NVDA / MRVL — incremental inference workloads"
      ],
      "victims": [
        "Point-product security vendors (single-feature plays)",
        "Budget-constrained SMB software (squeezed by sec spend)",
        "Legacy AV (NortonLifeLock/Gen Digital relative)"
      ],
      "timeline": {
        "D": "Gap-up + analyst PT hikes across security comp set.",
        "W": "Multiple expansion for ZS/CRWD into earnings.",
        "M": "NTSK / Wiz IPO chatter accelerates.",
        "L": "Cyber becomes 'must-own' subsector vs SaaS deceleration."
      },
      "sentiment": "mixed"
    },
    {
      "id": 3,
      "headline": "US-Iran talks fragile · Oil rises to one-week high · Netanyahu the wedge",
      "source": "Reuters / Bloomberg · 3–8h ago",
      "url": "https://finance.yahoo.com/economy/policy/articles/trump-netanyahu-problem-latest-key-202620111.html",
      "category": "Geopolitics · Energy",
      "priority": 9,
      "confidence": "MED",
      "tickers": [
        {
          "symbol": "XOM",
          "score": 3
        },
        {
          "symbol": "CVX",
          "score": 3
        },
        {
          "symbol": "OXY",
          "score": 2
        },
        {
          "symbol": "SLB",
          "score": 2
        },
        {
          "symbol": "HAL",
          "score": 2
        },
        {
          "symbol": "RTX",
          "score": 2
        },
        {
          "symbol": "LMT",
          "score": 2
        },
        {
          "symbol": "USO",
          "score": 1
        },
        {
          "symbol": "UAL",
          "score": -2
        },
        {
          "symbol": "DAL",
          "score": -2
        },
        {
          "symbol": "LUV",
          "score": -2
        },
        {
          "symbol": "EEM",
          "score": -1
        },
        {
          "symbol": "INDA",
          "score": -1
        },
        {
          "symbol": "XLY",
          "score": -1
        }
      ],
      "levels": {
        "L1": {
          "text": "Iran reviewing US proposal, but Israel's Hezbollah campaign threatens a deal. Trump wants nuclear concessions in writing. WTI back above $94, Brent near $96. Strait of Hormuz risk remains the tail-risk."
        },
        "L2": {
          "text": "Airlines and shippers hit by jet-fuel/bunker pass-through. Refiners (VLO, MPC) benefit short-term on crack spreads. Oil-services capex outlook firms (SLB, HAL, BKR). Defense primes bid as Middle East risk premium re-anchors."
        },
        "L3": {
          "text": "Sticky energy = sticky CPI = Fed stays cautious on cuts → USD support, EM oil-importers pressured (India, Indonesia, Turkey). Confirms Goldman's 'energy-shock buffered' rationale for North Asia overweight."
        }
      },
      "beneficiaries": [
        "US E&Ps: XOM, CVX, OXY, COP, EOG, FANG",
        "Oilfield services: SLB, HAL, BKR",
        "Refiners (short-term cracks): VLO, MPC, PSX",
        "Defense: RTX, LMT, NOC, GD",
        "USD & US-energy-independence narrative"
      ],
      "victims": [
        "US airlines: UAL, DAL, LUV, AAL",
        "Cruise/leisure: CCL, RCL (fuel pass-through)",
        "EM oil-importers: INDA, EIDO, TUR",
        "Consumer discretionary & gasoline-sensitive retail"
      ],
      "timeline": {
        "D": "Headline-driven crude swings; defense bid on any escalation.",
        "W": "If talks fail: $100+ WTI scenario re-prices CPI prints.",
        "M": "Refinery utilization + capex cycle benefits services.",
        "L": "Reinforces structural US LNG export build (LNG, CQP)."
      },
      "sentiment": "mixed"
    },
    {
      "id": 4,
      "headline": "SpaceX prepares record $75B IPO at $1.8T valuation; staff push for VIP terms",
      "source": "Bloomberg · 11h ago",